,text
325,"Quasi-conformal Geometry based Local Deformation Analysis of Lateral
  Cephalogram for Childhood OSA Classification"
326,pyBKT: An Accessible Python Library of Bayesian Knowledge Tracing Models
327,"Task-Prior Conditional Variational Auto-Encoder for Few-Shot Image
  Classification"
328,Interpretable Super-Resolution via a Learned Time-Series Representation
329,Deep Learning and Synthetic Media
330,Underwater Image Enhancement Using Convolutional Neural Network
331,"A Bayesian Finite Mixture Model with Variable Selection for Data with
  Mixed-type Variables"
332,"Neural Check-Worthiness Ranking with Weak Supervision: Finding Sentences
  for Fact-Checking"
333,"Self-Adaptive Soft Voice Activity Detection using Deep Neural Networks
  for Robust Speaker Verification"
334,Combating Adversaries with Anti-Adversaries
335,Contextual Recurrent Neural Networks
336,Recipe2Vec: Multi-modal Recipe Representation Learning with Graph Neural Networks
337,"DNN-Buddies: A Deep Neural Network-Based Estimation Metric for the
  Jigsaw Puzzle Problem"
338,"AutoTinyBERT: Automatic Hyper-parameter Optimization for Efficient
  Pre-trained Language Models"
339,Brownian Noise Reduction: Maximizing Privacy Subject to Accuracy Constraints
340,"MissDAG: Causal Discovery in the Presence of Missing Data with
  Continuous Additive Noise Models"
341,"Learning to Reason Deductively: Math Word Problem Solving as Complex
  Relation Extraction"
342,TransBoost: Improving the Best ImageNet Performance using Deep Transduction
343,Parametric Probabilistic Quantum Memory
344,Probing Emergent Semantics in Predictive Agents via Question Answering
345,Real-Time EMG Signal Classification via Recurrent Neural Networks
346,Recovery of Sparse Signals Using Multiple Orthogonal Least Squares
347,"Map matching when the map is wrong: Efficient vehicle tracking on- and
  off-road for map learning"
348,Shallow Domain Adaptive Embeddings for Sentiment Analysis
349,"Analytical Probability Distributions and EM-Learning for Deep Generative
  Networks"
350,Few-Shot Adversarial Learning of Realistic Neural Talking Head Models
351,"One Network for Multi-Domains: Domain Adaptive Hashing with Intersectant
  Generative Adversarial Network"
352,Contrastive Variational Autoencoder Enhances Salient Features
353,"ST-GAN: Spatial Transformer Generative Adversarial Networks for Image
  Compositing"
354,"VocGAN: A High-Fidelity Real-time Vocoder with a Hierarchically-nested
  Adversarial Network"
355,Online Learning of Assignments that Maximize Submodular Functions
356,"Beyond 5G: Leveraging Cell Free TDD Massive MIMO using Cascaded Deep
  learning"
357,Click-Through Rate Prediction in Online Advertising: A Literature Review
358,Gradient-Based Neural DAG Learning
359,"An Adversarial Learning Based Approach for Unknown View Tomographic
  Reconstruction"
360,A comparison of cluster algorithms as applied to unsupervised surveys
361,TWEET-FID: An Annotated Dataset for Multiple Foodborne Illness Detection Tasks
362,Deep Learning for Patient-Specific Kidney Graft Survival Analysis
363,"Exploring Biases and Prejudice of Facial Synthesis via Semantic Latent
  Space"
364,"Small nonlinearities in activation functions create bad local minima in
  neural networks"
365,Homonym Identification using BERT -- Using a Clustering Approach
366,"MLOps -- Definitions, Tools and Challenges"
367,"Efficient Data Representation by Selecting Prototypes with Importance
  Weights"
368,"Machine Learning for Data-Driven Movement Generation: a Review of the
  State of the Art"
369,Capsule GAN Using Capsule Network for Generator Architecture
370,"How rotational invariance of common kernels prevents generalization in
  high dimensions"
371,Multi-label classification search space in the MEKA software
372,"On the (Non-)Robustness of Two-Layer Neural Networks in Different
  Learning Regimes"
373,"HetEmotionNet: Two-Stream Heterogeneous Graph Recurrent Neural Network
  for Multi-modal Emotion Recognition"
374,Multi-Dueling Bandits and Their Application to Online Ranker Evaluation
375,"Spatial and spectral deep attention fusion for multi-channel speech
  separation using deep embedding features"
376,Accelerating Reinforcement Learning through Implicit Imitation
377,A Multimodal Deep Network for the Reconstruction of T2W MR Images
378,"A Free Lunch with Influence Functions? Improving Neural Network
  Estimates with Concepts from Semiparametric Statistics"
379,Xp-GAN: Unsupervised Multi-object Controllable Video Generation
380,"A new interval-based aggregation approach based on bagging and Interval
  Agreement Approach (IAA) in ensemble learning"
381,Deep Learning for Wireless Communications
382,Unsupervised Emergence of Spatial Structure from Sensorimotor Prediction
383,Unit Commitment using Nearest Neighbor as a Short-Term Proxy
384,Optimizing differential equations to fit data and predict outcomes
385,"Is the Skip Connection Provable to Reform the Neural Network Loss
  Landscape?"
386,GST: Group-Sparse Training for Accelerating Deep Reinforcement Learning
387,On Hyperparameter Search in Cluster Ensembles
388,Approximation Schemes for Low-Rank Binary Matrix Approximation Problems
389,DRUM: End-To-End Differentiable Rule Mining On Knowledge Graphs
390,Compressing Neural Language Models by Sparse Word Representations
391,"A Survey on Artificial Intelligence for Source Code: A Dialogue Systems
  Perspective"
392,Robust Kernel-based Distribution Regression
393,A Kernelised Stein Statistic for Assessing Implicit Generative Models
394,"Algorithmic Theory of ODEs and Sampling from Well-conditioned Logconcave
  Densities"
395,Deep Semi-Supervised Learning for Time Series Classification
396,"The Information Theoretically Efficient Model (ITEM): A model for
  computerized analysis of large datasets"
397,"Evaluating a Multi-sense Definition Generation Model for Multiple
  Languages"
398,Efficient and Convergent Federated Learning
399,G2G: TTS-Driven Pronunciation Learning for Graphemic Hybrid ASR
400,"Spatiotemporally Constrained Action Space Attacks on Deep Reinforcement
  Learning Agents"
401,Generative Adversarial Self-Imitation Learning
402,Improved Image Wasserstein Attacks and Defenses
403,Developing Constrained Neural Units Over Time
404,"An Abstraction-based Method to Check Multi-Agent Deep
  Reinforcement-Learning Behaviors"
405,"No One Left Behind: Inclusive Federated Learning over Heterogeneous
  Devices"
406,Accurate Emotion Strength Assessment for Seen and Unseen Speech Based on Data-Driven Deep Learning
407,"Syndicated Bandits: A Framework for Auto Tuning Hyper-parameters in
  Contextual Bandit Algorithms"
408,Semantics-Preserving Adversarial Training
409,Context Trees: Augmenting Geospatial Trajectories with Context
410,"Predicting Alzheimer's Disease by Hierarchical Graph Convolution from
  Positron Emission Tomography Imaging"
411,Deep Learning is Robust to Massive Label Noise
412,"Contrastive Learning of Medical Visual Representations from Paired
  Images and Text"
413,"A Review of Open-World Learning and Steps Toward Open-World Learning
  Without Labels"
414,Unsupervised Doppler Radar-Based Activity Recognition for e-Healthcare
415,Isconna: Streaming Anomaly Detection with Frequency and Patterns
416,Evaluating Attribution Methods using White-Box LSTMs
417,Behavior of Graph Laplacians on Manifolds with Boundary
418,"Attacks, Defenses, And Tools: A Framework To Facilitate Robust AI/ML
  Systems"
419,"SenseFitting: Sense Level Semantic Specialization of Word Embeddings for
  Word Sense Disambiguation"
420,"Stochastic Second-order Methods for Non-convex Optimization with Inexact
  Hessian and Gradient"
421,"Immiscible Color Flows in Optimal Transport Networks for Image
  Classification"
422,"A deep learning modeling framework to capture mixing patterns in
  reactive-transport systems"
423,Online Learning for Time Series Prediction
424,"Development of Computable Phenotype to Identify and Characterize
  Transitions in Acuity Status in Intensive Care Unit"
425,Distributed Deep Q-Learning
426,VEGN: Variant Effect Prediction with Graph Neural Networks
427,Scalable Regularised Joint Mixture Models
428,Energy-aware adaptive bi-Lipschitz embeddings
429,Input Convex Neural Networks
430,Learning ELM network weights using linear discriminant analysis
431,Explainable boosted linear regression for time series forecasting
432,The Natural Language Decathlon: Multitask Learning as Question Answering
433,Privileged Graph Distillation for Cold Start Recommendation
434,"Concept Formation and Dynamics of Repeated Inference in Deep Generative
  Models"
435,"On Coresets for Fair Clustering in Metric and Euclidean Spaces and Their
  Applications"
436,Automatic differentiation of nonsmooth iterative algorithms
437,Adaptive Regularization for Weight Matrices
438,Faster Policy Learning with Continuous-Time Gradients
439,Brain Tumor Synthetic Segmentation in 3D Multimodal MRI Scans
440,"Neural Network-Inspired Analog-to-Digital Conversion to Achieve
  Super-Resolution with Low-Precision RRAM Devices"
441,"A data-driven approach to sampling matrix selection for compressive
  sensing"
442,"Calibrated Predictive Distributions via Diagnostics for Conditional
  Coverage"
443,"On the Impact of Applying Machine Learning in the Decision-Making of
  Self-Adaptive Systems"
444,"Towards Imperceptible and Robust Adversarial Example Attacks against
  Neural Networks"
445,SeedGNN: Graph Neural Networks for Supervised Seeded Graph Matching
446,"Reinforcing Medical Image Classifier to Improve Generalization on Small
  Datasets"
447,Parameterizing Activation Functions for Adversarial Robustness
448,"Revisiting Neighborhood-based Link Prediction for Collaborative
  Filtering"
449,Tractable Regularization of Probabilistic Circuits
450,"A Question-Centric Model for Visual Question Answering in Medical
  Imaging"
451,Jointist: Joint Learning for Multi-instrument Transcription and Its Applications
452,"Single-trial P300 Classification using PCA with LDA, QDA and Neural
  Networks"
453,"STNN-DDI: A Substructure-aware Tensor Neural Network to Predict
  Drug-Drug Interactions"
454,Robust Neural Networks using Randomized Adversarial Training
455,"Sparsely Connected and Disjointly Trained Deep Neural Networks for Low
  Resource Behavioral Annotation: Acoustic Classification in Couples' Therapy"
456,Kronecker Attention Networks
457,"Machine learning for rapid discovery of laminar flow channel wall
  modifications that enhance heat transfer"
458,"Estimating Koopman operators for nonlinear dynamical systems: a
  nonparametric approach"
459,"A Computational Analysis of Pitch Drift in Unaccompanied Solo Singing
  using DBSCAN Clustering"
460,Learning Kernel-Based Halfspaces with the Zero-One Loss
461,Learning Undirected Graphical Models with Structure Penalty
462,"Unifying Behavioral and Response Diversity for Open-ended Learning in
  Zero-sum Games"
463,Learning in Non-convex Games with an Optimization Oracle
464,PyTorch Metric Learning
465,"Regularized linear system identification using atomic, nuclear and
  kernel-based norms: the role of the stability constraint"
466,Enhancing Explainability of Hyperparameter Optimization via Bayesian Algorithm Execution
467,"Efficient Probabilistic Performance Bounds for Inverse Reinforcement
  Learning"
468,SIRUS: Stable and Interpretable RUle Set for Classification
469,Detecting Autism Spectrum Disorder using Machine Learning
470,Sparse MoEs meet Efficient Ensembles
471,"Uncertainty Modeling of Emerging Device-based Computing-in-Memory Neural
  Accelerators with Application to Neural Architecture Search"
472,Algorithms for metric learning via contrastive embeddings
473,Efficient Linear Bandits through Matrix Sketching
474,The Theory and Algorithm of Ergodic Inference
475,"A Review of Artificial Intelligence Technologies for Early Prediction of
  Alzheimer's Disease"
476,"Pedagogical Demonstrations and Pragmatic Learning in Artificial
  Tutor-Learner Interactions"
477,Effective Abstract Reasoning with Dual-Contrast Network
478,"Local nearest neighbour classification with applications to
  semi-supervised learning"
479,"Graph-Preserving Grid Layout: A Simple Graph Drawing Method for Graph
  Classification using CNNs"
480,STUDD: A Student-Teacher Method for Unsupervised Concept Drift Detection
481,Detecting model drift using polynomial relations
482,"Inverse Reinforcement Learning in Large State Spaces via Function
  Approximation"
483,"Differentiable sampling of molecular geometries with uncertainty-based
  adversarial attacks"
484,"CNN Filter DB: An Empirical Investigation of Trained Convolutional
  Filters"
485,"Memorizing Gaussians with no over-parameterizaion via gradient decent on
  neural networks"
486,"Improved Estimation of Concentration Under $\ell_p$-Norm Distance
  Metrics Using Half Spaces"
487,"Unsupervised feature learning from finite data by message passing:
  discontinuous versus continuous phase transition"
488,Recurrent Neural Networks (RNNs): A gentle Introduction and Overview
489,"Kalman filter demystified: from intuition to probabilistic graphical
  model to real case in financial markets"
490,Multiplicative noise and heavy tails in stochastic optimization
491,Community Detection in Partially Observable Social Networks
492,Online Collective Animal Movement Activity Recognition
493,"Unsupervised Neural Mask Estimator For Generalized Eigen-Value
  Beamforming Based ASR"
494,Reducing Capacity Gap in Knowledge Distillation with Review Mechanism for Crowd Counting
495,Human Pose Forecasting via Deep Markov Models
496,"DEALIO: Data-Efficient Adversarial Learning for Imitation from
  Observation"
497,Learning Linear Non-Gaussian Graphical Models with Multidirected Edges
498,Exponential expressivity in deep neural networks through transient chaos
499,"Energy-Efficient Adaptive Machine Learning on IoT End-Nodes With
  Class-Dependent Confidence"
